{"$schema":"https://json-schema.org/draft/2020-12/schema","title":"Invoice Domain Review Result","type":"object","required":["review_type","task_id","verdict","invariants","findings"],"properties":{"review_type":{"const":"invoice-domain"},"task_id":{"type":"string"},"verdict":{"enum":["PASS","CHANGES_REQUIRED","BLOCKED_BY_AMBIGUITY","BLOCKED_BY_MISSING_CONTEXT"]},"invariants":{"type":"array"},"findings":{"type":"array"}},"additionalProperties":true}
